{
  "schema_version": "1.0.0",
  "library": "aspa-methodology-books",
  "purpose": "Методическая библиотека для работы над текстом диссертации: подготовка, защита, оформление, чтение, аргументация, выступление. Не является источником научных доказательств реестра.",
  "source_dir": "../docs/Текста",
  "checked_at": "2026-10-26",
  "books": [
    {
      "book_id": "B001",
      "title": "Как написать дипломную работу. Гуманитарные науки",
      "authors": ["Эко Умберто"],
      "translators": [],
      "language": "ru",
      "year": null,
      "publisher": null,
      "city": null,
      "isbn": [],
      "format": "fb2",
      "completeness": "full_text",
      "origin": {"kind": "file", "file": "kak-napisat-diplomnuiu-rabotu-gumanitarnye-nauki.fb2"},
      "sha256": "8a8360189bd48dbd9e96be03d4953774d5293c1ef31a08ceb6f66512540de9f9",
      "options": {"inline_headings": "roman_decimal"},
      "field_resolution": {
        "year": {"status": "not_reported", "reason": "FB2 publish-info отсутствует", "locator": "description/publish-info"},
        "publisher": {"status": "not_reported", "reason": "FB2 publish-info отсутствует", "locator": "description/publish-info"},
        "city": {"status": "not_reported", "reason": "FB2 publish-info отсутствует", "locator": "description/publish-info"},
        "isbn": {"status": "not_reported", "reason": "FB2 publish-info отсутствует", "locator": "description/publish-info"},
        "translators": {"status": "not_reported", "reason": "Переводчик в title-info не указан", "locator": "description/title-info"}
      },
      "notes": "Конвертер слил каждую главу в один абзац; подразделы III. 1. 1. восстановлены по строгой последовательности номеров, их заголовки — первые слова раздела."
    },
    {
      "book_id": "B002",
      "title": "Как читать книги. Руководство по чтению великих произведений",
      "authors": ["Адлер Мортимер"],
      "translators": ["Плостак Лариса"],
      "language": "ru",
      "original_language": "en",
      "year": "2011",
      "publisher": "Манн, Иванов и Фербер",
      "city": "Москва",
      "isbn": ["978-5-91657-186-8"],
      "format": "fb2",
      "completeness": "full_text",
      "origin": {"kind": "file", "file": "Мортимер Адлер Как читать книги. Руководство по чтению великих произведений.fb2"},
      "sha256": "6e68499f763a0d5f51d61e4250be99ac7928b78d6901b18152777abfa679ed8c",
      "options": {"exclude_sections": ["Максимально полезные книги от издательства", "Именной указатель"]},
      "field_resolution": {},
      "notes": "Исключены рекламный раздел издательства и именной указатель."
    },
    {
      "book_id": "B003",
      "title": "Искусство говорить и слушать",
      "authors": ["Адлер Мортимер"],
      "translators": ["Анваер Александр Николаевич", "Плостак Лариса"],
      "language": "ru",
      "original_language": "en",
      "year": "2013",
      "publisher": "Манн, Иванов и Фербер",
      "city": null,
      "isbn": ["978-5-91657-580-4"],
      "format": "fb2",
      "completeness": "full_text",
      "origin": {"kind": "file", "file": "Мортимер Адлер_Искусство говорить и слушать.fb2"},
      "sha256": "e0411bbfe1369d40cfff512f8f5a42222597980b4df570231c4d341597f7ed8a",
      "options": {},
      "field_resolution": {
        "city": {"status": "not_reported", "reason": "Город в FB2 publish-info не указан", "locator": "description/publish-info"}
      },
      "notes": ""
    },
    {
      "book_id": "B004",
      "title": "Как работать над диссертацией",
      "authors": ["Новиков А. М."],
      "translators": [],
      "language": "ru",
      "year": "2003",
      "publisher": "Эгвес",
      "city": "Москва",
      "isbn": ["5-85449-127-6"],
      "edition": "4-е изд., перераб. и доп.; 104 с.",
      "format": "fb2",
      "completeness": "full_text",
      "origin": {"kind": "file", "file": "Новиков А.. Как работать над диссертацией - royallib.ru.fb2"},
      "sha256": "60405366101e4ea8619cd8b75f117d64afcf39128653b3a9fcb5063eb7d86805",
      "options": {},
      "field_resolution": {},
      "notes": "Файл в кодировке windows-1251; автор в FB2 указан инициалами."
    },
    {
      "book_id": "B005",
      "title": "Убеждай и побеждай. Секреты эффективной аргументации",
      "authors": ["Непряхин Никита"],
      "translators": [],
      "language": "ru",
      "year": "2012",
      "publisher": "Альпина Паблишер",
      "city": "Москва",
      "isbn": ["978-5-9614-1793-7"],
      "edition": "2-е изд.; 254 с.",
      "format": "pdf",
      "completeness": "full_text",
      "origin": {"kind": "file", "file": "Непряхин Н. - Убеждай и побеждай. Секреты эффективной аргументации - 2012.pdf"},
      "sha256": "f1a8819b366f804ab0677a79d4c82847782d85f2e33c6ba593d0784a34abaa57",
      "options": {
        "pdf_layout": "pages",
        "join_split_words": true,
        "toc": [
          {"level": 1, "title": "Оглавление", "page": 5},
          {"level": 1, "title": "Предисловие", "page": 9},
          {"level": 1, "title": "Введение", "page": 11},
          {"level": 1, "title": "Глава 1. Аргументация: от логики до рабулистики", "page": 15},
          {"level": 1, "title": "Глава 2. Структура аргументации", "page": 21},
          {"level": 2, "title": "Тезис", "page": 23},
          {"level": 2, "title": "Аргументы", "page": 27},
          {"level": 2, "title": "Демонстрация", "page": 30},
          {"level": 2, "title": "Основные логические ошибки", "page": 31},
          {"level": 2, "title": "Практика", "page": 33},
          {"level": 1, "title": "Глава 3. Правила эффективного аргумента", "page": 39},
          {"level": 2, "title": "Поддержка и пример", "page": 39},
          {"level": 2, "title": "Создание визуального образа", "page": 42},
          {"level": 2, "title": "Линия аргументации", "page": 45},
          {"level": 2, "title": "Оценка аргументов", "page": 49},
          {"level": 2, "title": "Практика", "page": 52},
          {"level": 1, "title": "Глава 4. Виды аргументации", "page": 61},
          {"level": 2, "title": "Прямая и косвенная аргументация", "page": 61},
          {"level": 2, "title": "Рациональная и эмоциональная аргументация", "page": 63},
          {"level": 2, "title": "Теоретическая и эмпирическая аргументация", "page": 67},
          {"level": 2, "title": "Универсальная и контекстуальная аргументация", "page": 68},
          {"level": 1, "title": "Глава 5. Аргументация ad hominem: победа любой ценой", "page": 71},
          {"level": 2, "title": "Аргументы к человеку — ad hominem", "page": 71},
          {"level": 2, "title": "Аргументы к публике — ad populum", "page": 80},
          {"level": 2, "title": "Аргументы к невежеству — ad ignorantiam", "page": 82},
          {"level": 2, "title": "Аргументы к жалости, состраданию — ad misericordiam", "page": 84},
          {"level": 2, "title": "Аргументы к авторитету — ipse dixit", "page": 86},
          {"level": 2, "title": "Аргумент к силе — ad baculinum", "page": 89},
          {"level": 2, "title": "Практика", "page": 90},
          {"level": 1, "title": "Глава 6. 30 «золотых» правил эффективного убеждения", "page": 93},
          {"level": 1, "title": "Глава 7. Тактики утверждения", "page": 117},
          {"level": 2, "title": "Фундаментальная тактика «Прямое убеждение»", "page": 118},
          {"level": 2, "title": "«Бремя доказывания»", "page": 120},
          {"level": 2, "title": "«Инициатива в споре»", "page": 121},
          {"level": 2, "title": "«Искренняя позиция»", "page": 124},
          {"level": 2, "title": "«Кунктация»", "page": 127},
          {"level": 1, "title": "Глава 8. Тактики отрицания", "page": 131},
          {"level": 2, "title": "Фундаментальная тактика «Прямое отрицание»", "page": 133},
          {"level": 2, "title": "Тактика противоречий", "page": 134},
          {"level": 2, "title": "Тактика следствий", "page": 135},
          {"level": 2, "title": "«Бить по поддержкам и примерам»", "page": 137},
          {"level": 2, "title": "Тактика приведения «большего» контраргумента в ответ на «меньший» аргумент", "page": 139},
          {"level": 2, "title": "Демонстрация неубедительности", "page": 141},
          {"level": 2, "title": "Тактика «Бумеранг»", "page": 142},
          {"level": 2, "title": "«Найти слабую сторону»", "page": 143},
          {"level": 2, "title": "«Плохой механизм реализации»", "page": 145},
          {"level": 2, "title": "«Доведение до абсурда»", "page": 147},
          {"level": 2, "title": "Философская тактика", "page": 149},
          {"level": 2, "title": "Тактика «видимой поддержки»", "page": 151},
          {"level": 2, "title": "Рефрейминг", "page": 153},
          {"level": 2, "title": "Практика", "page": 157},
          {"level": 1, "title": "Глава 9. 50 уловок в аргументации", "page": 159},
          {"level": 2, "title": "Психологические уловки", "page": 175},
          {"level": 2, "title": "Отражение уловок", "page": 190},
          {"level": 2, "title": "Практика", "page": 195},
          {"level": 1, "title": "Глава 10. Правила конструктивного спора", "page": 199},
          {"level": 1, "title": "Глава 11. Аргументация в сфере продаж", "page": 205},
          {"level": 2, "title": "Аргументация предложения", "page": 208},
          {"level": 2, "title": "Аргументация цены", "page": 211},
          {"level": 2, "title": "Преодоление возражений", "page": 213},
          {"level": 1, "title": "Глава 12. Аргументация в рекламе", "page": 217},
          {"level": 2, "title": "Практика", "page": 221},
          {"level": 1, "title": "Глава 13. Импровизация в аргументации", "page": 225},
          {"level": 2, "title": "Практика", "page": 227},
          {"level": 1, "title": "Заключение", "page": 233},
          {"level": 1, "title": "Приложения", "page": 235},
          {"level": 2, "title": "Приложение 1. Словарь", "page": 235},
          {"level": 2, "title": "Приложение 2. Лучше не скажешь (цитатник)", "page": 241},